<!ELEMENT bookstore (book+)>

<!ELEMENT book (title, author, year, price?)>

<!ELEMENT title (#PCDATA)>
<!ELEMENT author (#PCDATA)>
<!ELEMENT year (#PCDATA)>
<!ELEMENT price (#PCDATA)>